{
  "version": "1.0.0",
  "metadata": {
    "title": "Tech Demo",
    "artist": "RhythmAether",
    "charter": "System",
    "audioFile": "../audio/test_beat.ogg",
    "difficulty": {
      "label": "Normal",
      "level": 4
    }
  },
  "timing": [
    {
      "beat": 0,
      "bpm": 120,
      "timeSignature": { "numerator": 4, "denominator": 4 }
    }
  ],
  "offset": 0.0,
  "notes": [
    { "type": "tap", "beat": 4.0, "x": 0.125 },
    { "type": "tap", "beat": 5.0, "x": 0.375 },
    { "type": "tap", "beat": 6.0, "x": 0.625 },
    { "type": "tap", "beat": 7.0, "x": 0.875 },

    { "type": "tap", "beat": 8.0, "x": 0.125 },
    { "type": "tap", "beat": 8.5, "x": 0.375 },
    { "type": "tap", "beat": 9.0, "x": 0.625 },
    { "type": "tap", "beat": 9.5, "x": 0.875 },

    { "type": "tap", "beat": 10.0, "x": 0.375 },
    { "type": "tap", "beat": 10.5, "x": 0.625 },
    { "type": "tap", "beat": 11.0, "x": 0.375 },
    { "type": "tap", "beat": 11.5, "x": 0.625 },

    { "type": "tap", "beat": 12.0, "x": 0.125 },
    { "type": "tap", "beat": 12.0, "x": 0.875 },
    { "type": "tap", "beat": 13.0, "x": 0.375 },
    { "type": "tap", "beat": 13.0, "x": 0.625 },

    { "type": "hold", "beat": 14.0, "endBeat": 16.0, "x": 0.375 },
    { "type": "tap", "beat": 15.0, "x": 0.875 },
    { "type": "tap", "beat": 15.5, "x": 0.625 },

    { "type": "tap", "beat": 16.0, "x": 0.125 },
    { "type": "tap", "beat": 16.5, "x": 0.375 },
    { "type": "tap", "beat": 17.0, "x": 0.625 },
    { "type": "tap", "beat": 17.5, "x": 0.875 },

    { "type": "tap", "beat": 18.0, "x": 0.375 },
    { "type": "tap", "beat": 18.25, "x": 0.625 },
    { "type": "tap", "beat": 18.5, "x": 0.375 },
    { "type": "tap", "beat": 18.75, "x": 0.625 },
    { "type": "tap", "beat": 19.0, "x": 0.125 },
    { "type": "tap", "beat": 19.0, "x": 0.875 },

    { "type": "hold", "beat": 20.0, "endBeat": 22.0, "x": 0.125 },
    { "type": "hold", "beat": 20.0, "endBeat": 22.0, "x": 0.875 },

    { "type": "tap", "beat": 22.0, "x": 0.375 },
    { "type": "tap", "beat": 22.0, "x": 0.625 },
    { "type": "tap", "beat": 23.0, "x": 0.125 },
    { "type": "tap", "beat": 23.0, "x": 0.375 },
    { "type": "tap", "beat": 23.0, "x": 0.625 },
    { "type": "tap", "beat": 23.0, "x": 0.875 },

    { "type": "tap", "beat": 24.0, "x": 0.375 },
    { "type": "tap", "beat": 24.5, "x": 0.625 },
    { "type": "tap", "beat": 25.0, "x": 0.375 },
    { "type": "tap", "beat": 25.5, "x": 0.625 },
    { "type": "tap", "beat": 26.0, "x": 0.125 },
    { "type": "tap", "beat": 26.5, "x": 0.375 },
    { "type": "tap", "beat": 27.0, "x": 0.625 },
    { "type": "tap", "beat": 27.5, "x": 0.875 },

    { "type": "hold", "beat": 28.0, "endBeat": 31.0, "x": 0.5 }
  ],
  "events": []
}
