{
  "version": "1.0.0",
  "metadata": {
    "title": "Dota 2 Battle Highlights",
    "artist": "AI Generated (ElevenLabs)",
    "charter": "AI Generator",
    "audioFile": "../audio/dota2_battle.ogg",
    "difficulty": {
      "label": "Normal",
      "level": 6
    },
    "videoFile": "../video/dota2_clip.ogv"
  },
  "timing": [
    {
      "beat": 0,
      "bpm": 140,
      "timeSignature": {
        "numerator": 4,
        "denominator": 4
      }
    }
  ],
  "offset": 0.24,
  "notes": [
    {
      "type": "tap",
      "beat": 0.0,
      "x": 0.875
    },
    {
      "type": "tap",
      "beat": 2.0,
      "x": 0.625
    },
    {
      "type": "tap",
      "beat": 4.0,
      "x": 0.375
    },
    {
      "type": "tap",
      "beat": 5.0,
      "x": 0.875
    },
    {
      "type": "tap",
      "beat": 8.0,
      "x": 0.375
    },
    {
      "type": "tap",
      "beat": 16.0,
      "x": 0.375
    },
    {
      "type": "tap",
      "beat": 21.0,
      "x": 0.125
    },
    {
      "type": "tap",
      "beat": 21.5,
      "x": 0.875
    },
    {
      "type": "tap",
      "beat": 25.0,
      "x": 0.125
    },
    {
      "type": "tap",
      "beat": 27.0,
      "x": 0.375
    },
    {
      "type": "tap",
      "beat": 27.5,
      "x": 0.125
    },
    {
      "type": "tap",
      "beat": 37.0,
      "x": 0.125
    },
    {
      "type": "tap",
      "beat": 37.5,
      "x": 0.375
    },
    {
      "type": "tap",
      "beat": 38.0,
      "x": 0.625
    },
    {
      "type": "tap",
      "beat": 38.5,
      "x": 0.875
    },
    {
      "type": "tap",
      "beat": 40.0,
      "x": 0.375
    },
    {
      "type": "tap",
      "beat": 40.5,
      "x": 0.125
    },
    {
      "type": "tap",
      "beat": 42.0,
      "x": 0.125
    },
    {
      "type": "tap",
      "beat": 42.5,
      "x": 0.875
    },
    {
      "type": "tap",
      "beat": 46.0,
      "x": 0.875
    },
    {
      "type": "tap",
      "beat": 46.5,
      "x": 0.625
    },
    {
      "type": "tap",
      "beat": 47.0,
      "x": 0.375
    },
    {
      "type": "tap",
      "beat": 47.5,
      "x": 0.125
    },
    {
      "type": "tap",
      "beat": 50.0,
      "x": 0.875
    },
    {
      "type": "tap",
      "beat": 54.0,
      "x": 0.875
    },
    {
      "type": "tap",
      "beat": 58.0,
      "x": 0.125
    },
    {
      "type": "tap",
      "beat": 58.5,
      "x": 0.375
    },
    {
      "type": "tap",
      "beat": 59.0,
      "x": 0.625
    },
    {
      "type": "tap",
      "beat": 59.5,
      "x": 0.875
    },
    {
      "type": "tap",
      "beat": 61.0,
      "x": 0.125
    },
    {
      "type": "tap",
      "beat": 61.0,
      "x": 0.625
    },
    {
      "type": "tap",
      "beat": 63.0,
      "x": 0.875
    },
    {
      "type": "hold",
      "beat": 65.0,
      "endBeat": 67.0,
      "x": 0.875
    },
    {
      "type": "tap",
      "beat": 66.0,
      "x": 0.625
    },
    {
      "type": "tap",
      "beat": 69.0,
      "x": 0.875
    },
    {
      "type": "hold",
      "beat": 70.0,
      "endBeat": 72.0,
      "x": 0.125
    },
    {
      "type": "tap",
      "beat": 71.0,
      "x": 0.375
    },
    {
      "type": "tap",
      "beat": 74.0,
      "x": 0.625
    },
    {
      "type": "tap",
      "beat": 74.5,
      "x": 0.375
    },
    {
      "type": "tap",
      "beat": 76.0,
      "x": 0.125
    },
    {
      "type": "tap",
      "beat": 76.5,
      "x": 0.375
    },
    {
      "type": "tap",
      "beat": 77.0,
      "x": 0.625
    },
    {
      "type": "tap",
      "beat": 77.5,
      "x": 0.875
    },
    {
      "type": "tap",
      "beat": 80.0,
      "x": 0.375
    },
    {
      "type": "tap",
      "beat": 80.0,
      "x": 0.875
    },
    {
      "type": "tap",
      "beat": 81.0,
      "x": 0.125
    },
    {
      "type": "tap",
      "beat": 81.5,
      "x": 0.625
    },
    {
      "type": "hold",
      "beat": 82.0,
      "endBeat": 84.0,
      "x": 0.125
    },
    {
      "type": "tap",
      "beat": 83.0,
      "x": 0.375
    },
    {
      "type": "tap",
      "beat": 85.0,
      "x": 0.625
    },
    {
      "type": "tap",
      "beat": 87.0,
      "x": 0.875
    },
    {
      "type": "tap",
      "beat": 88.0,
      "x": 0.375
    },
    {
      "type": "tap",
      "beat": 88.0,
      "x": 0.875
    },
    {
      "type": "tap",
      "beat": 90.0,
      "x": 0.875
    },
    {
      "type": "tap",
      "beat": 90.5,
      "x": 0.625
    },
    {
      "type": "tap",
      "beat": 91.0,
      "x": 0.375
    },
    {
      "type": "tap",
      "beat": 91.5,
      "x": 0.125
    },
    {
      "type": "tap",
      "beat": 93.0,
      "x": 0.375
    },
    {
      "type": "tap",
      "beat": 95.0,
      "x": 0.125
    },
    {
      "type": "tap",
      "beat": 95.5,
      "x": 0.375
    },
    {
      "type": "tap",
      "beat": 96.0,
      "x": 0.625
    },
    {
      "type": "tap",
      "beat": 96.5,
      "x": 0.875
    },
    {
      "type": "tap",
      "beat": 97.0,
      "x": 0.625
    },
    {
      "type": "tap",
      "beat": 97.5,
      "x": 0.875
    },
    {
      "type": "hold",
      "beat": 100.0,
      "endBeat": 102.0,
      "x": 0.875
    },
    {
      "type": "tap",
      "beat": 101.0,
      "x": 0.625
    },
    {
      "type": "tap",
      "beat": 105.0,
      "x": 0.875
    },
    {
      "type": "tap",
      "beat": 113.0,
      "x": 0.375
    },
    {
      "type": "tap",
      "beat": 113.5,
      "x": 0.625
    },
    {
      "type": "tap",
      "beat": 116.0,
      "x": 0.375
    },
    {
      "type": "tap",
      "beat": 116.0,
      "x": 0.875
    },
    {
      "type": "tap",
      "beat": 117.0,
      "x": 0.625
    },
    {
      "type": "tap",
      "beat": 119.0,
      "x": 0.875
    },
    {
      "type": "tap",
      "beat": 119.5,
      "x": 0.375
    },
    {
      "type": "tap",
      "beat": 126.0,
      "x": 0.625
    },
    {
      "type": "tap",
      "beat": 126.5,
      "x": 0.125
    },
    {
      "type": "hold",
      "beat": 130.0,
      "endBeat": 132.0,
      "x": 0.875
    },
    {
      "type": "tap",
      "beat": 131.0,
      "x": 0.625
    },
    {
      "type": "tap",
      "beat": 133.0,
      "x": 0.125
    },
    {
      "type": "tap",
      "beat": 134.0,
      "x": 0.375
    },
    {
      "type": "tap",
      "beat": 135.0,
      "x": 0.125
    },
    {
      "type": "tap",
      "beat": 135.5,
      "x": 0.625
    },
    {
      "type": "tap",
      "beat": 136.0,
      "x": 0.375
    },
    {
      "type": "tap",
      "beat": 136.0,
      "x": 0.875
    }
  ],
  "events": []
}