{
  "version": "1.0.0",
  "metadata": {
    "title": "Digital Pulse",
    "artist": "RhythmAether",
    "charter": "System",
    "audioFile": "../audio/demo_track.ogg",
    "difficulty": {
      "label": "Normal",
      "level": 4
    }
  },
  "timing": [
    {
      "beat": 0,
      "bpm": 120,
      "timeSignature": { "numerator": 4, "denominator": 4 }
    }
  ],
  "offset": 0.0,
  "notes": [
    {"type": "tap", "beat": 0.0, "x": 0.375},
    {"type": "tap", "beat": 2.0, "x": 0.625},
    {"type": "tap", "beat": 4.0, "x": 0.375},
    {"type": "tap", "beat": 6.0, "x": 0.625},

    {"type": "tap", "beat": 8.0, "x": 0.125},
    {"type": "tap", "beat": 8.5, "x": 0.375},
    {"type": "tap", "beat": 9.0, "x": 0.625},
    {"type": "tap", "beat": 9.5, "x": 0.875},
    {"type": "tap", "beat": 10.0, "x": 0.875},
    {"type": "tap", "beat": 10.5, "x": 0.625},
    {"type": "tap", "beat": 11.0, "x": 0.375},
    {"type": "tap", "beat": 11.5, "x": 0.125},

    {"type": "tap", "beat": 12.0, "x": 0.375},
    {"type": "tap", "beat": 12.5, "x": 0.625},
    {"type": "tap", "beat": 13.0, "x": 0.375},
    {"type": "tap", "beat": 13.5, "x": 0.625},
    {"type": "tap", "beat": 14.0, "x": 0.125},
    {"type": "tap", "beat": 14.0, "x": 0.875},
    {"type": "tap", "beat": 15.0, "x": 0.375},
    {"type": "tap", "beat": 15.0, "x": 0.625},

    {"type": "hold", "beat": 16.0, "endBeat": 18.0, "x": 0.125},
    {"type": "tap", "beat": 17.0, "x": 0.625},
    {"type": "tap", "beat": 17.5, "x": 0.875},
    {"type": "hold", "beat": 18.0, "endBeat": 20.0, "x": 0.875},
    {"type": "tap", "beat": 19.0, "x": 0.125},
    {"type": "tap", "beat": 19.5, "x": 0.375},

    {"type": "tap", "beat": 20.0, "x": 0.375},
    {"type": "tap", "beat": 20.5, "x": 0.625},
    {"type": "tap", "beat": 21.0, "x": 0.375},
    {"type": "tap", "beat": 21.5, "x": 0.625},
    {"type": "tap", "beat": 22.0, "x": 0.125},
    {"type": "tap", "beat": 22.5, "x": 0.375},
    {"type": "tap", "beat": 23.0, "x": 0.625},
    {"type": "tap", "beat": 23.5, "x": 0.875},

    {"type": "tap", "beat": 24.0, "x": 0.375},
    {"type": "tap", "beat": 24.25, "x": 0.625},
    {"type": "tap", "beat": 24.5, "x": 0.375},
    {"type": "tap", "beat": 24.75, "x": 0.625},
    {"type": "tap", "beat": 25.0, "x": 0.125},
    {"type": "tap", "beat": 25.5, "x": 0.375},
    {"type": "tap", "beat": 26.0, "x": 0.625},
    {"type": "tap", "beat": 26.5, "x": 0.875},
    {"type": "tap", "beat": 27.0, "x": 0.125},
    {"type": "tap", "beat": 27.0, "x": 0.875},

    {"type": "hold", "beat": 28.0, "endBeat": 30.0, "x": 0.375},
    {"type": "hold", "beat": 28.0, "endBeat": 30.0, "x": 0.625},
    {"type": "tap", "beat": 30.0, "x": 0.125},
    {"type": "tap", "beat": 30.5, "x": 0.375},
    {"type": "tap", "beat": 31.0, "x": 0.625},
    {"type": "tap", "beat": 31.5, "x": 0.875},

    {"type": "tap", "beat": 32.0, "x": 0.125},
    {"type": "tap", "beat": 32.0, "x": 0.375},
    {"type": "tap", "beat": 32.0, "x": 0.625},
    {"type": "tap", "beat": 32.0, "x": 0.875},

    {"type": "tap", "beat": 33.0, "x": 0.375},
    {"type": "tap", "beat": 33.5, "x": 0.625},
    {"type": "tap", "beat": 34.0, "x": 0.375},
    {"type": "tap", "beat": 34.5, "x": 0.625},
    {"type": "tap", "beat": 35.0, "x": 0.125},
    {"type": "tap", "beat": 35.0, "x": 0.875},
    {"type": "tap", "beat": 35.5, "x": 0.375},
    {"type": "tap", "beat": 35.5, "x": 0.625},

    {"type": "hold", "beat": 36.0, "endBeat": 38.0, "x": 0.125},
    {"type": "tap", "beat": 36.0, "x": 0.625},
    {"type": "tap", "beat": 36.5, "x": 0.875},
    {"type": "tap", "beat": 37.0, "x": 0.625},
    {"type": "tap", "beat": 37.5, "x": 0.875},

    {"type": "tap", "beat": 38.0, "x": 0.375},
    {"type": "tap", "beat": 38.25, "x": 0.625},
    {"type": "tap", "beat": 38.5, "x": 0.375},
    {"type": "tap", "beat": 38.75, "x": 0.625},
    {"type": "tap", "beat": 39.0, "x": 0.125},
    {"type": "tap", "beat": 39.25, "x": 0.375},
    {"type": "tap", "beat": 39.5, "x": 0.625},
    {"type": "tap", "beat": 39.75, "x": 0.875},

    {"type": "tap", "beat": 40.0, "x": 0.375},
    {"type": "tap", "beat": 40.5, "x": 0.625},
    {"type": "tap", "beat": 41.0, "x": 0.375},
    {"type": "tap", "beat": 41.5, "x": 0.625},
    {"type": "tap", "beat": 42.0, "x": 0.125},
    {"type": "tap", "beat": 42.0, "x": 0.875},
    {"type": "tap", "beat": 43.0, "x": 0.375},
    {"type": "tap", "beat": 43.0, "x": 0.625},

    {"type": "hold", "beat": 44.0, "endBeat": 46.0, "x": 0.375},
    {"type": "hold", "beat": 44.0, "endBeat": 46.0, "x": 0.625},

    {"type": "tap", "beat": 46.0, "x": 0.125},
    {"type": "tap", "beat": 46.5, "x": 0.375},
    {"type": "tap", "beat": 47.0, "x": 0.625},
    {"type": "tap", "beat": 47.5, "x": 0.875},
    {"type": "tap", "beat": 48.0, "x": 0.375},
    {"type": "tap", "beat": 48.5, "x": 0.625},
    {"type": "tap", "beat": 49.0, "x": 0.375},
    {"type": "tap", "beat": 49.5, "x": 0.625},

    {"type": "tap", "beat": 50.0, "x": 0.125},
    {"type": "tap", "beat": 50.0, "x": 0.375},
    {"type": "tap", "beat": 50.0, "x": 0.625},
    {"type": "tap", "beat": 50.0, "x": 0.875},

    {"type": "hold", "beat": 52.0, "endBeat": 56.0, "x": 0.375},
    {"type": "hold", "beat": 52.0, "endBeat": 56.0, "x": 0.625},

    {"type": "tap", "beat": 56.0, "x": 0.125},
    {"type": "tap", "beat": 56.0, "x": 0.375},
    {"type": "tap", "beat": 56.0, "x": 0.625},
    {"type": "tap", "beat": 56.0, "x": 0.875},

    {"type": "hold", "beat": 60.0, "endBeat": 63.0, "x": 0.5}
  ],
  "events": []
}
